{
  "schema_name": "petra.model-call",
  "schema_version": "1.1.0",
  "model_call_id": "model_call_01ARZ3NDEKTSV4RRFFQ69G5FE5",
  "revision": 1,
  "content": {
    "model_request_id": "model_request_01ARZ3NDEKTSV4RRFFQ69G5FE4",
    "attempt": 1,
    "attempt_kind": "initial",
    "deployment": {
      "model_deployment_id": "model_deployment_01ARZ3NDEKTSV4RRFFQ69G5FE1",
      "provider_id": "provider_01ARZ3NDEKTSV4RRFFQ69G5FE2",
      "provider_kind": "fixture",
      "provider_model": "petra-synthesist-fixture",
      "observed_revision": "fixture-v1",
      "replayability": "exact",
      "endpoint_fingerprint": "sha256:abababababababababababababababababababababababababababababababab"
    },
    "prompt_profile": {
      "name": "petra-grounded-synthesist",
      "version": "1.0.0",
      "content_hash": "sha256:eeeeeeeeeeeeeeeeeeeeeeeeeeeeeeeeeeeeeeeeeeeeeeeeeeeeeeeeeeeeeeee"
    },
    "parameters_hash": "sha256:3333333333333333333333333333333333333333333333333333333333333333",
    "output_contract": {
      "schema_name": "model-synthesist-output",
      "schema_version": "1.0.0",
      "schema_hash": "sha256:c9feeb397df01f2772c81c53fd2edadf7154c836a273df87a8e47806b500164b"
    },
    "input": {
      "context_packet_ref": {
        "context_packet_id": "context_packet_01ARZ3NDEKTSV4RRFFQ69G5FCD",
        "content_hash": "sha256:d78e5ebed5060507812eeeede6154f82e8f9bbfb19897bd8ade82909088432df"
      },
      "evidence_packet_ref": {
        "evidence_packet_id": "evidence_packet_01ARZ3NDEKTSV4RRFFQ69G5FCG",
        "content_hash": "sha256:e3d7679bec56bc80f2bbb9702398526ca69edac1c10836132efc365c36393d64"
      },
      "messages": [
        {
          "role": "system",
          "content": "Synthesize only from the immutable EvidencePacket. Separate source reports, Petra synthesis, and unresolved inference."
        },
        {
          "role": "user",
          "content": "Explain the selected report and its recorded limits."
        }
      ],
      "context_selections": [
        {
          "context_selection_order": 1,
          "object_ref": {
            "object_kind": "claim",
            "object_id": "claim_01ARZ3NDEKTSV4RRFFQ69G5FBB",
            "object_revision": 2,
            "object_hash": "sha256:b316d82c938b5d76fc02e11dab16d71f1bcf2788ed66d8aacfac7c622330e7fa"
          },
          "rendered_content": "Claim: The study reports a measurable improvement on its evaluation task.",
          "source_span_selection_orders": [3]
        },
        {
          "context_selection_order": 2,
          "object_ref": {
            "object_kind": "assertion",
            "object_id": "assertion_01ARZ3NDEKTSV4RRFFQ69G5FBC",
            "object_revision": 2,
            "object_hash": "sha256:80dcb2c8926d758f99a45d9ca84b720e23f4583c45583586d28998b9bc013f8d"
          },
          "rendered_content": "Assertion: The selected WorkVersion ASSERTS the selected Claim.",
          "source_span_selection_orders": [3]
        },
        {
          "context_selection_order": 3,
          "object_ref": {
            "object_kind": "source_span",
            "object_id": "source_span_01ARZ3NDEKTSV4RRFFQ69G5FB7",
            "object_revision": 1,
            "object_hash": "sha256:4767af515647f5ae6602c3d54b813d2d226a8bcc9f333374a4e73e6aaa3ba565"
          },
          "rendered_content": "SourceSpan: The study reports a measurable improvement.",
          "source_span_selection_orders": [3]
        }
      ],
      "content_hash": "sha256:2222222222222222222222222222222222222222222222222222222222222222"
    },
    "provider_request_id": "fixture-synthesis-1",
    "outcome": "success",
    "raw_output": {
      "schema_name": "petra.model-synthesist-output",
      "schema_version": "1.0.0",
      "statements": [
        {
          "statement_key": "source_report_1",
          "origin": "source_report",
          "text": "The selected WorkVersion reports the bounded Claim.",
          "evidence_refs": [
            {
              "context_selection_order": 2,
              "object_kind": "assertion",
              "object_id": "assertion_01ARZ3NDEKTSV4RRFFQ69G5FBC",
              "object_revision": 2,
              "object_hash": "sha256:80dcb2c8926d758f99a45d9ca84b720e23f4583c45583586d28998b9bc013f8d",
              "source_span_selection_orders": [3]
            }
          ],
          "limitations": [
            "This is source attribution, not independent proof of truth."
          ]
        }
      ],
      "coverage": {
        "state": "complete_for_context",
        "statement": "Every selected context object is accounted for, but the packet is not literature-complete.",
        "material_omissions_acknowledged": true,
        "abstract_only_sources_used": false,
        "contrary_evidence_status": "checked_none_in_context",
        "qualifying_evidence_status": "checked_none_in_context"
      }
    },
    "output": {
      "schema_name": "petra.model-synthesist-output",
      "schema_version": "1.0.0",
      "statements": [
        {
          "statement_key": "source_report_1",
          "origin": "source_report",
          "text": "The selected WorkVersion reports the bounded Claim.",
          "evidence_refs": [
            {
              "context_selection_order": 2,
              "object_kind": "assertion",
              "object_id": "assertion_01ARZ3NDEKTSV4RRFFQ69G5FBC",
              "object_revision": 2,
              "object_hash": "sha256:80dcb2c8926d758f99a45d9ca84b720e23f4583c45583586d28998b9bc013f8d",
              "source_span_selection_orders": [3]
            }
          ],
          "limitations": [
            "This is source attribution, not independent proof of truth."
          ]
        }
      ],
      "coverage": {
        "state": "complete_for_context",
        "statement": "Every selected context object is accounted for, but the packet is not literature-complete.",
        "material_omissions_acknowledged": true,
        "abstract_only_sources_used": false,
        "contrary_evidence_status": "checked_none_in_context",
        "qualifying_evidence_status": "checked_none_in_context"
      }
    },
    "validation": [
      {
        "validator_name": "model-output-schema",
        "validator_version": "1.0.0",
        "outcome": "pass",
        "code": "SCHEMA_VALID"
      },
      {
        "validator_name": "grounded-synthesis",
        "validator_version": "1.0.0",
        "outcome": "pass",
        "code": "EVIDENCE_REFS_RESOLVED"
      }
    ],
    "timing": {
      "queue_ms": 0,
      "first_token_ms": 2,
      "total_ms": 4,
      "validation_ms": 1
    },
    "usage": {
      "accounting": "provider_reported",
      "input_tokens": 240,
      "output_tokens": 120
    },
    "cost": {
      "amount": "0",
      "currency": "USD",
      "accounting": "computed",
      "pricing_source": "Local fixture deployment; no marginal token charge."
    }
  },
  "content_hash": "sha256:7777777777777777777777777777777777777777777777777777777777777777",
  "started_at": "2026-09-03T18:31:00.000Z",
  "completed_at": "2026-09-03T18:31:00.004Z"
}
